{
  "$schema": "https://json-schema.org/draft/2019-09/schema",
  "definitions": {
    "quantra_enums_DayCounter" : {
      "type" : "string",
      "enum": ["Actual360", "Actual365Fixed", "Actual365NoLeap", "ActualActual", "ActualActualISMA", "ActualActualBond", "ActualActualISDA", "ActualActualHistorical", "ActualActual365", "ActualActualAFB", "ActualActualEuro", "Business252", "One", "Simple", "Thirty360"]
    },
    "quantra_enums_Interpolator" : {
      "type" : "string",
      "enum": ["BackwardFlat", "ForwardFlat", "Linear", "LogCubic", "LogLinear"]
    },
    "quantra_enums_SurfaceInterpolator2D" : {
      "type" : "string",
      "enum": ["Bilinear", "Bicubic"]
    },
    "quantra_enums_BootstrapTrait" : {
      "type" : "string",
      "enum": ["Discount", "FwdRate", "InterpolatedDiscount", "InterpolatedFwd", "InterpolatedZero", "ZeroRate"]
    },
    "quantra_enums_TimeUnit" : {
      "type" : "string",
      "enum": ["Days", "Hours", "Microseconds", "Milliseconds", "Minutes", "Months", "Seconds", "Weeks", "Years"]
    },
    "quantra_enums_Calendar" : {
      "type" : "string",
      "enum": ["Argentina", "Australia", "BespokeCalendar", "Brazil", "Canada", "China", "CzechRepublic", "Denmark", "Finland", "Germany", "HongKong", "Hungary", "Iceland", "India", "Indonesia", "Israel", "Italy", "Japan", "Mexico", "NewZealand", "Norway", "NullCalendar", "Poland", "Romania", "Russia", "SaudiArabia", "Singapore", "Slovakia", "SouthAfrica", "SouthKorea", "Sweden", "Switzerland", "TARGET", "Taiwan", "Turkey", "Ukraine", "UnitedKingdom", "UnitedStates", "UnitedStatesGovernmentBond", "UnitedStatesNERC", "UnitedStatesNYSE", "UnitedStatesSettlement", "WeekendsOnly"]
    },
    "quantra_enums_BusinessDayConvention" : {
      "type" : "string",
      "enum": ["Following", "HalfMonthModifiedFollowing", "ModifiedFollowing", "ModifiedPreceding", "Nearest", "Preceding", "Unadjusted"]
    },
    "quantra_enums_Frequency" : {
      "type" : "string",
      "enum": ["Annual", "Bimonthly", "Biweekly", "Daily", "EveryFourthMonth", "EveryFourthWeek", "Monthly", "NoFrequency", "Once", "OtherFrequency", "Quarterly", "Semiannual", "Weekly"]
    },
    "quantra_enums_DateGenerationRule" : {
      "type" : "string",
      "enum": ["Backward", "CDS", "Forward", "OldCDS", "ThirdWednesday", "Twentieth", "TwentiethIMM", "Zero"]
    },
    "quantra_enums_CdsEngineType" : {
      "type" : "string",
      "enum": ["MidPoint", "ISDA"]
    },
    "quantra_enums_CdsHelperModel" : {
      "type" : "string",
      "enum": ["MidPoint", "ISDA"]
    },
    "quantra_enums_CdsQuoteType" : {
      "type" : "string",
      "enum": ["ParSpread", "Upfront"]
    },
    "quantra_enums_CdsIsdaNumericalFix" : {
      "type" : "string",
      "enum": ["None", "Taylor"]
    },
    "quantra_enums_CdsIsdaAccrualBias" : {
      "type" : "string",
      "enum": ["HalfDayBias", "NoBias"]
    },
    "quantra_enums_CdsIsdaForwardsInCouponPeriod" : {
      "type" : "string",
      "enum": ["Flat", "Piecewise"]
    },
    "quantra_enums_Compounding" : {
      "type" : "string",
      "enum": ["Compounded", "Continuous", "Simple", "SimpleThenCompounded"]
    },
    "quantra_enums_RateAveragingType" : {
      "type" : "string",
      "enum": ["Compound", "Simple"]
    },
    "quantra_enums_SwapType" : {
      "type" : "string",
      "enum": ["Payer", "Receiver"]
    },
    "quantra_enums_PayReceive" : {
      "type" : "string",
      "enum": ["Pay", "Receive"]
    },
    "quantra_enums_FRAType" : {
      "type" : "string",
      "enum": ["Long", "Short"]
    },
    "quantra_enums_CapFloorType" : {
      "type" : "string",
      "enum": ["Cap", "Floor", "Collar"]
    },
    "quantra_enums_CallabilityType" : {
      "type" : "string",
      "enum": ["Call", "Put"]
    },
    "quantra_enums_ExerciseType" : {
      "type" : "string",
      "enum": ["European", "Bermudan", "American"]
    },
    "quantra_enums_SettlementType" : {
      "type" : "string",
      "enum": ["Physical", "Cash"]
    },
    "quantra_enums_SettlementMethod" : {
      "type" : "string",
      "enum": ["PhysicalOTC", "PhysicalCleared", "CollateralizedCashPrice", "ParYieldCurve"]
    },
    "quantra_enums_ProtectionSide" : {
      "type" : "string",
      "enum": ["Buyer", "Seller"]
    },
    "quantra_enums_VolatilityType" : {
      "type" : "string",
      "enum": ["Normal", "Lognormal", "ShiftedLognormal"]
    },
    "quantra_enums_VolSurfaceShape" : {
      "type" : "string",
      "enum": ["Constant", "AtmMatrix2D", "SmileCube3D", "SurfaceFromPrices", "SabrParams", "SabrCalibrate"]
    },
    "quantra_enums_YoYInflationCapFloorEngineType" : {
      "type" : "string",
      "enum": ["Black", "UnitDisplacedBlack", "Bachelier"]
    },
    "quantra_enums_SwaptionVolKind" : {
      "type" : "string",
      "enum": ["Constant", "AtmMatrix2D", "SmileCube3D", "SabrParams", "SabrCalibrate"]
    },
    "quantra_enums_SwaptionStrikeKind" : {
      "type" : "string",
      "enum": ["Absolute", "SpreadFromATM"]
    },
    "quantra_enums_InflationCurveKind" : {
      "type" : "string",
      "enum": ["ZeroInflation", "YoYInflation"]
    },
    "quantra_enums_InflationCurveMeasure" : {
      "type" : "string",
      "enum": ["ZeroRate", "YoYRate"]
    },
    "quantra_enums_CPIInterpolationType" : {
      "type" : "string",
      "enum": ["AsIndex", "Flat", "Linear"]
    },
    "quantra_enums_BondPriceType" : {
      "type" : "string",
      "enum": ["Clean", "Dirty"]
    },
    "quantra_enums_IrModelType" : {
      "type" : "string",
      "enum": ["Black", "ShiftedBlack", "Bachelier", "HullWhiteLattice"]
    },
    "quantra_enums_ModelParamMode" : {
      "type" : "string",
      "enum": ["Explicit", "Calibrate"]
    },
    "quantra_enums_CmsPricerType" : {
      "type" : "string",
      "enum": ["LinearTsr", "HaganAnalytic", "HaganNumeric"]
    },
    "quantra_enums_CmsYieldCurveModel" : {
      "type" : "string",
      "enum": ["Standard", "ExactYield", "ParallelShifts", "NonParallelShifts"]
    },
    "quantra_enums_EquityModelType" : {
      "type" : "string",
      "enum": ["BlackScholesAnalytic", "BinomialCRR"]
    },
    "quantra_enums_EquityOptionType" : {
      "type" : "string",
      "enum": ["Call", "Put"]
    },
    "quantra_enums_EquitySettlementType" : {
      "type" : "string",
      "enum": ["Physical", "Cash"]
    },
    "quantra_enums_EquityBarrierType" : {
      "type" : "string",
      "enum": ["DownIn", "UpIn", "DownOut", "UpOut"]
    },
    "quantra_enums_EquityBarrierMonitoring" : {
      "type" : "string",
      "enum": ["Continuous", "Discrete"]
    },
    "quantra_enums_FxDirection" : {
      "type" : "string",
      "enum": ["BuyBase", "SellBase"]
    },
    "quantra_enums_SwapFlowKind" : {
      "type" : "string",
      "enum": ["Coupon", "NotionalExchange"]
    },
    "quantra_CalendarOverride" : {
      "type" : "object",
      "description" : "Per-request holiday overrides for one calendar. The overrides apply to every\nuse of that calendar while the request is processed and are discarded\nafterwards; nothing is stored on the server.",
      "properties" : {
        "calendar" : {
                "$ref" : "#/definitions/quantra_enums_Calendar",
                "description" : "Calendar to override (required). Aliases of the same underlying calendar\n(e.g. UnitedStates / UnitedStatesSettlement) share their overrides."
              },
        "added_holidays" : {
                "type" : "array", "items" : {"type" : "string"},
                "description" : "Dates (YYYY-MM-DD) that must be treated as holidays. A date that is\nalready a holiday or a weekend is accepted and has no effect."
              },
        "removed_holidays" : {
                "type" : "array", "items" : {"type" : "string"},
                "description" : "Dates (YYYY-MM-DD) that must be treated as business days. A date that is\nalready a business day is accepted and has no effect; weekend dates are\nrejected."
              }
      },
      "additionalProperties" : false
    },
    "quantra_CalendarAdvanceRequest" : {
      "type" : "object",
      "description" : "Request to advance a date by a calendar-aware period.",
      "properties" : {
        "calendar" : {
                "$ref" : "#/definitions/quantra_enums_Calendar"
              },
        "date" : {
                "type" : "string",
                "description" : "Date in YYYY-MM-DD format."
              },
        "tenor_number" : {
                "type" : "integer", "minimum" : -2147483648, "maximum" : 2147483647,
                "description" : "Number of units; can be negative for back-shift."
              },
        "tenor_unit" : {
                "$ref" : "#/definitions/quantra_enums_TimeUnit"
              },
        "convention" : {
                "$ref" : "#/definitions/quantra_enums_BusinessDayConvention"
              },
        "end_of_month" : {
                "type" : "boolean"
              },
        "calendar_overrides" : {
                "type" : "array", "items" : {"$ref" : "#/definitions/quantra_CalendarOverride"},
                "description" : "Per-request holiday overrides (optional)."
              }
      },
      "required" : ["date"],
      "additionalProperties" : false
    }
  },
  "$ref" : "#/definitions/quantra_CalendarAdvanceRequest"
}
